[
  {
    "available": true,
    "category": "berry",
    "description": "Elimina la parálisis del portador. Puede usarse una vez por combate.",
    "id": "item-149",
    "identity": true,
    "name": "Baya Zreza",
    "restrictions": []
  },
  {
    "available": true,
    "category": "berry",
    "description": "Elimina el sueño del portador. Puede usarse una vez por combate.",
    "id": "item-150",
    "identity": true,
    "name": "Baya Atania",
    "restrictions": []
  },
  {
    "available": true,
    "category": "berry",
    "description": "Elimina el envenenamiento y el envenenamiento grave del portador. Puede usarse una vez por combate.",
    "id": "item-151",
    "identity": true,
    "name": "Baya Meloc",
    "restrictions": []
  },
  {
    "available": true,
    "category": "berry",
    "description": "Elimina las quemaduras del portador. Puede usarse una vez por combate.",
    "id": "item-152",
    "identity": true,
    "name": "Baya Safre",
    "restrictions": []
  },
  {
    "available": true,
    "category": "berry",
    "description": "Elimina la congelación del portador. Puede usarse una vez por combate.",
    "id": "item-153",
    "identity": true,
    "name": "Baya Perasi",
    "restrictions": []
  },
  {
    "available": true,
    "category": "berry",
    "description": "Restaura 10 PP de un movimiento del portador al que no le quedan PP. Puede usarse una vez por combate.",
    "id": "item-154",
    "identity": true,
    "name": "Baya Zanama",
    "restrictions": []
  },
  {
    "available": true,
    "category": "berry",
    "description": "Restaura 10 PS del portador cuando sus PS máximos se ven reducidos a la mitad o menos. Puede usarse una vez por combate.",
    "id": "item-155",
    "identity": true,
    "name": "Baya Aranja",
    "restrictions": []
  },
  {
    "available": true,
    "category": "berry",
    "description": "Elimina la confusión del portador. Puede usarse una vez por combate.",
    "id": "item-156",
    "identity": true,
    "name": "Baya Caquic",
    "restrictions": []
  },
  {
    "available": true,
    "category": "berry",
    "description": "Elimina todos los problemas de estado y la confusión del portador. Puede usarse una vez por combate.",
    "id": "item-157",
    "identity": true,
    "name": "Baya Ziuela",
    "restrictions": []
  },
  {
    "available": true,
    "category": "berry",
    "description": "Restaura 1/4 de los PS máximos del portador cuando se ven reducidos a la mitad o menos. Puede usarse una vez por combate.",
    "id": "item-158",
    "identity": true,
    "name": "Baya Zidra",
    "restrictions": []
  },
  {
    "available": true,
    "category": "berry",
    "description": "Reduce a la mitad el daño de un ataque supereficaz de tipo Fuego que el portador reciba. Puede usarse una vez por combate.",
    "id": "item-184",
    "identity": true,
    "name": "Baya Caoca",
    "restrictions": []
  },
  {
    "available": true,
    "category": "berry",
    "description": "Reduce a la mitad el daño de un ataque supereficaz de tipo Agua que el portador reciba. Puede usarse una vez por combate.",
    "id": "item-185",
    "identity": true,
    "name": "Baya Pasio",
    "restrictions": []
  },
  {
    "available": true,
    "category": "berry",
    "description": "Reduce a la mitad el daño de un ataque supereficaz de tipo Eléctrico que el portador reciba. Puede usarse una vez por combate.",
    "id": "item-186",
    "identity": true,
    "name": "Baya Gualot",
    "restrictions": []
  },
  {
    "available": true,
    "category": "berry",
    "description": "Reduce a la mitad el daño de un ataque supereficaz de tipo Planta que el portador reciba. Puede usarse una vez por combate.",
    "id": "item-187",
    "identity": true,
    "name": "Baya Tamar",
    "restrictions": []
  },
  {
    "available": true,
    "category": "berry",
    "description": "Reduce a la mitad el daño de un ataque supereficaz de tipo Hielo que el portador reciba. Puede usarse una vez por combate.",
    "id": "item-188",
    "identity": true,
    "name": "Baya Rimoya",
    "restrictions": []
  },
  {
    "available": true,
    "category": "berry",
    "description": "Reduce a la mitad el daño de un ataque supereficaz de tipo Lucha que el portador reciba. Puede usarse una vez por combate.",
    "id": "item-189",
    "identity": true,
    "name": "Baya Pomaro",
    "restrictions": []
  },
  {
    "available": true,
    "category": "berry",
    "description": "Reduce a la mitad el daño de un ataque supereficaz de tipo Veneno que el portador reciba. Puede usarse una vez por combate.",
    "id": "item-190",
    "identity": true,
    "name": "Baya Kebia",
    "restrictions": []
  },
  {
    "available": true,
    "category": "berry",
    "description": "Reduce a la mitad el daño de un ataque supereficaz de tipo Tierra que el portador reciba. Puede usarse una vez por combate.",
    "id": "item-191",
    "identity": true,
    "name": "Baya Acardo",
    "restrictions": []
  },
  {
    "available": true,
    "category": "berry",
    "description": "Reduce a la mitad el daño de un ataque supereficaz de tipo Volador que el portador reciba. Puede usarse una vez por combate.",
    "id": "item-192",
    "identity": true,
    "name": "Baya Kouba",
    "restrictions": []
  },
  {
    "available": true,
    "category": "berry",
    "description": "Reduce a la mitad el daño de un ataque supereficaz de tipo Psíquico que el portador reciba. Puede usarse una vez por combate.",
    "id": "item-193",
    "identity": true,
    "name": "Baya Payapa",
    "restrictions": []
  },
  {
    "available": true,
    "category": "berry",
    "description": "Reduce a la mitad el daño de un ataque supereficaz de tipo Bicho que el portador reciba. Puede usarse una vez por combate.",
    "id": "item-194",
    "identity": true,
    "name": "Baya Yecana",
    "restrictions": []
  },
  {
    "available": true,
    "category": "berry",
    "description": "Reduce a la mitad el daño de un ataque supereficaz de tipo Roca que el portador reciba. Puede usarse una vez por combate.",
    "id": "item-195",
    "identity": true,
    "name": "Baya Alcho",
    "restrictions": []
  },
  {
    "available": true,
    "category": "berry",
    "description": "Reduce a la mitad el daño de un ataque supereficaz de tipo Fantasma que el portador reciba. Puede usarse una vez por combate.",
    "id": "item-196",
    "identity": true,
    "name": "Baya Drasi",
    "restrictions": []
  },
  {
    "available": true,
    "category": "berry",
    "description": "Reduce a la mitad el daño de un ataque supereficaz de tipo Dragón que el portador reciba. Puede usarse una vez por combate.",
    "id": "item-197",
    "identity": true,
    "name": "Baya Anjiro",
    "restrictions": []
  },
  {
    "available": true,
    "category": "berry",
    "description": "Reduce a la mitad el daño de un ataque supereficaz de tipo Siniestro que el portador reciba. Puede usarse una vez por combate.",
    "id": "item-198",
    "identity": true,
    "name": "Baya Dillo",
    "restrictions": []
  },
  {
    "available": true,
    "category": "berry",
    "description": "Reduce a la mitad el daño de un ataque supereficaz de tipo Acero que el portador reciba. Puede usarse una vez por combate.",
    "id": "item-199",
    "identity": true,
    "name": "Baya Baribá",
    "restrictions": []
  },
  {
    "available": true,
    "category": "berry",
    "description": "Reduce a la mitad el daño de un ataque de tipo Normal que el portador reciba. Puede usarse una vez por combate.",
    "id": "item-200",
    "identity": true,
    "name": "Baya Chilan",
    "restrictions": []
  },
  {
    "available": true,
    "category": "held-item",
    "description": "Reduce un 10 % la precisión de los movimientos que el rival usa contra el portador.",
    "id": "item-213",
    "identity": true,
    "name": "Polvo Brillo",
    "restrictions": []
  },
  {
    "available": true,
    "category": "held-item",
    "description": "Restaura las características del portador que se hayan visto reducidas. Puede usarse una vez por combate.",
    "id": "item-214",
    "identity": true,
    "name": "Hierba Blanca",
    "restrictions": []
  },
  {
    "available": true,
    "category": "held-item",
    "description": "Hace que el portador tenga una probabilidad del 20 % de actuar primero cuando su movimiento tiene la misma prioridad que otros.",
    "id": "item-217",
    "identity": true,
    "name": "Garra Rápida",
    "restrictions": []
  },
  {
    "available": true,
    "category": "held-item",
    "description": "Elimina los estados Enamorado, Mofa, Repetición anulada, Movimiento anulado, Cura anulada y Otra Vez del portador. Puede usarse una vez por combate.",
    "id": "item-219",
    "identity": true,
    "name": "Hierba Mental",
    "restrictions": []
  },
  {
    "available": true,
    "category": "held-item",
    "description": "Hace que el portador tenga una probabilidad del 10 % de amedrentar al objetivo al infligirle daño con un movimiento.",
    "id": "item-221",
    "identity": true,
    "name": "Roca del Rey",
    "restrictions": []
  },
  {
    "available": true,
    "category": "held-item",
    "description": "Aumenta un 20 % la potencia de los movimientos de tipo Bicho del portador.",
    "id": "item-222",
    "identity": true,
    "name": "Polvo Plata",
    "restrictions": []
  },
  {
    "available": true,
    "category": "held-item",
    "description": "Hace que el portador tenga una probabilidad del 10 % de aguantar con 1 PS un movimiento que lo debilitaría.",
    "id": "item-230",
    "identity": true,
    "name": "Cinta Aguante",
    "restrictions": []
  },
  {
    "available": true,
    "category": "held-item",
    "description": "Aumenta un nivel la probabilidad de asestar golpes críticos del portador.",
    "id": "item-232",
    "identity": true,
    "name": "Periscopio",
    "restrictions": []
  },
  {
    "available": true,
    "category": "held-item",